FALSCH	FALSCH	FALSCH	Wolff.2016b	Wolff, Mechthild; Norys, Tobias	Sexualisierte Jugend?	Sozialmagazin	3 Thematischer Fokus; 3.2 Gewaltprävention; 4 Fachkräfte; 4.1 Pädagogische Fachkräfte; 6 Gewalt; 6.2 Übergriff, Peergewalt; 9 Förderlinie; 9.1.12 Safer Places	Forschungsergebnisse // research results; Jugendliche // youth; Kinder- und Jugendhilfe // child welfare system; Peergewalt // peer violence; Qualitative Forschung // qualitative research; Sexualisierte Gewalt // sexual violence
FALSCH	FALSCH	FALSCH	Wolff.2017	Wolff, Mechthild; Schröer, Wolfgang; Fegert, Jörg M.	Schutzkonzepte in Theorie und Praxis		2 Institutioneller Kontext; 3 Thematischer Fokus; 3.2 Gewaltprävention; 3.3 Kinderschutz; 9 Förderlinie; 9.1.3 Ich bin sicher!	Institutionelle Dynamiken // institutional dynamics; Institutioneller Missbrauch // institutional abuse; Pädagogik // pedagogy; Pädagogische Einrichtung // educational facilities; Psychologie // psychology; Schutzkonzept // protection concept; Soziale Arbeit // Social Work
FALSCH	FALSCH	FALSCH	Albrecht.2016	Albrecht, Maria; Lattwein, Svenja; Urban-Stahl, Ulrike	Der Hausbesuch im Kontext des Schutzauftrags bei Kindeswohlgefährdung	Neue Praxis	2 Institutioneller Kontext; 2.1 Institutionelle Dynamiken; 2.2.6 Sonstige Einrichtungen; 3 Thematischer Fokus; 3.3 Kinderschutz	Eltern // parents; Fachberatungsstelle // specialist counselling; Familie // family; Kinderschutz // child protection; Kindeswohl // child welfare; Kommunikation // communication; Kooperation // cooperation; Pädagogik // pedagogy; Pädagogische Beziehung // pedagogical relationship; Partizipation // participation; Professionalität // professionality; Risikofaktoren // risk factors; Schutzfaktoren // protection factor; Schutzkonzept // protection concept; Weiterbildung // further education
FALSCH	FALSCH	FALSCH	Bollert.2018	Böllert, Karin	Kompendium Kinder- und Jugendhilfe		3 Thematischer Fokus; 3.3 Kinderschutz	Handbuch // handbook; Kinder- und Jugendhilfe // child welfare system; Soziale Arbeit // Social Work
FALSCH	FALSCH	FALSCH	Wolfl.2020	Wölfl, Andreas; Siebert, Silke	Musiktherapie mit Opfern von Missbrauch und Gewalt		6 Gewalt; 6.1 Sexueller Missbrauch; 6.4 Disclosure, Aufarbeitung	Aufarbeitung // rehabilitation; Bedarfe // needs; Betroffene sexualisierter Gewalt // sexual assault survivors; Psychologie // psychology; Psychotherapie // psychotherapy; Sexuelle Belästigung // sexual harassment; Sexueller Missbrauch // sexual abuse; Sexueller Übergriff // sexual assault; Soziale Arbeit // Social Work
FALSCH	FALSCH	FALSCH	Olson.2018	Wolters, Laura	Grauzonen		1 Soziale Rahmung; 1.1 Diskurse; 1.4 Identitäten; 1.4.1 Geschlecht; 6 Gewalt; 6.1 Sexueller Missbrauch; 6.2 Übergriff, Peergewalt	Aufarbeitung // rehabilitation; Betroffene sexualisierter Gewalt // sexual assault survivors; Bewältigung // coping; Diskurs // discourse; Feminismus // feminism; Gewalt // violence; Gewalt gegen Frauen // violence against women; Grenzen // boundaries; Intervention // intervention; Sexuelle Belästigung // sexual harassment; Sexueller Missbrauch // sexual abuse; Sexueller Übergriff // sexual assault
FALSCH	FALSCH	FALSCH	Womann.2018	Wößmann, Ludger; Lergetporer, Philipp; Grewenig, Elisabeth; Kersten, Sarah; Werner, Katharina	Was denken die Deutschen zu Geschlechterthemen und Gleichstellung in der Bildung?	Ifo-Schnelldienst	1 Soziale Rahmung; 1.1 Diskurse; 1.4 Identitäten; 1.4.1 Geschlecht; 6 Gewalt; 6.3 Diskriminierung; 8 Forschung	Forschungsergebnisse // research results; Geschlecht // gender; Quantitative Forschung // quantitative research; Survey // survey
FALSCH	FALSCH	FALSCH	Yildiz.2020	Yildiz, Erol	Flucht und strukturelle Gewalt: Von der Opferkonstruktion zur Alltagspraxis	Migration und soziale Arbeit	1 Soziale Rahmung; 1.1 Diskurse; 1.4 Identitäten; 1.4.3 Ethnizität; 6 Gewalt; 6.5 Negative Folgen	Forschungsstand // state of research; Geflüchtete // refugees; Gewalt // violence; Jugendliche // youth; junge Erwachsene // young adults; Kinder // children; Sexualisierte Gewalt // sexual violence
FALSCH	FALSCH	FALSCH	Zacharias.2019	Zacharias, Anna; Decker, Alexandra	Viel Kummer mit der Liebe. Themen von Heranwachsenden aus der Perspektive der„Nummer gegen Kummer“	UJ (unsere jugend)	1 Soziale Rahmung; 1.2 Leitlinien; 3 Thematischer Fokus; 3.4 Intervention	Achtsamkeit // awareness; Bedarfe // needs; Differenz // difference; Fachberatungsstelle // specialist counselling; Organisationskultur // organisational culture; Pädagogik // pedagogy; Partizipation // participation; Professionalität // professionality; Soziale Arbeit // Social Work
FALSCH	FALSCH	FALSCH	Zimmermann.2016	Zimmermann, Julia	Das Bundeskinderschutzgesetz aus Schulperspektive	Sozial Extra (Sozial Extra)	2 Institutioneller Kontext; 2.2 Einrichtungen; 2.2.2 Grundschule; 2.2.3 Weiterführende Schule; 3 Thematischer Fokus; 3.3 Kinderschutz	Kinder // children; Kinder- und Jugendhilfe // child welfare system; Lehrer*innen // Teachers; Partizipation // participation; Recht // law; Schule // school; Schüler*innen // pupils
FALSCH	FALSCH	FALSCH	Zimmermann.2020	Zimmermann, Laura	Gewalt in der Erziehung		4 Fachkräfte; 4.1 Pädagogische Fachkräfte; 4.2 Andere Fachkräfte; 5 Adressat*innen; 5.3 Eltern und Familie; 6 Gewalt; 6.1 Sexueller Missbrauch; 6.2 Übergriff, Peergewalt; 6.3 Diskriminierung; 6.5 Negative Folgen	Gewalt // violence; Handbuch // handbook; Pädagogik // pedagogy
FALSCH	FALSCH	FALSCH	Zimmermann.2015	Zimmermann, Peter; Celik, Fatma	Heilt die Zeit alle Wunden?	ZSE (Zeitschrift für Soziologie der Erziehung und Sozialisation)	3 Thematischer Fokus; 3.1 Sexualpädagogik; 5 Adressat*innen; 5.2 Jugendliche; 7 Sexualität; 7.1 Sexuelle Erfahrungen; 7.2 Beziehungsgestaltung	Bedarfe // needs; Beziehungsgestaltung // relationships; Forschungsergebnisse // research results; Jugendliche // youth; Quantitative Forschung // quantitative research; Survey // survey
FALSCH	FALSCH	FALSCH	Zinsmeister.2018b	Zinsmeister, Julia; Vogel, Anna-Katharina	Mehrdimensionale Diskriminierungen	Vierteljahresschrift für Heilpädagogik und ihre Nachbargebiete	1 Soziale Rahmung; 1.1 Diskurse; 1.4 Identitäten; 1.4.1 Geschlecht; 1.4.5 Behinderungen; 6 Gewalt; 6.3 Diskriminierung	Diskriminierung // discrimination; Diskursanalyse // discourse analysis; Forschungsergebnisse // research results; Geschlecht // gender; Intersektionalität // intersectionality; Menschen mit Behinderungen // people with disabilities
FALSCH	FALSCH	FALSCH	Zipfel.2019	Zipfel, Astrid	Wirkungstheorien der Medien- und-Gewalt-Forschung		6 Gewalt; 6.1 Sexueller Missbrauch; 6.2 Übergriff, Peergewalt; 6.4 Disclosure, Aufarbeitung; 8 Forschung	Digitale Medien // digital media; Forschungsmethoden // research methods; Forschungsstand // state of research; Gewalt // violence
FALSCH	FALSCH	FALSCH	Borrmann.2019	Borrmann, Stefan; Fedke, Christoph; Thiessen, Barbara	Soziale Kohäsion und gesellschaftliche Wandlungsprozesse		1 Soziale Rahmung; 1.1 Diskurse	Menschenrechte // human rights; Normen // norms; Organisationskultur // organisational culture; Pädagogik // pedagogy; Pädagogische Einrichtung // educational facilities; Pädagogische Fachkräfte // pedagogial staff; Partizipation // participation; Recht // law; Soziale Arbeit // Social Work; Soziale Ungleichheit // social inequality; Sozialwissenschaften // social sciences; Theorie // theory
FALSCH	FALSCH	FALSCH	Zoja.2018	Zoja, Luigi	Männlichkeit und kollektive Gewalt		1 Soziale Rahmung; 1.1 Diskurse; 1.4 Identitäten; 1.4.1 Geschlecht; 6 Gewalt; 6.1 Sexueller Missbrauch	Diskurs // discourse; Männer // men; Sexualisierte Gewalt // sexual violence
FALSCH	FALSCH	FALSCH	Allroggen.2017	Allroggen, Marc; Domann, Sophie; Eßer, Florian; Fegert, Jörg M.; Kampert, Meike; Rau, Thea; Rusack, Tanja; Schloz, Carolin; Schröer, Wolfgang; Strahl, Benjamin; Wolff, Mechthild	Einleitung		3 Thematischer Fokus; 3.2 Gewaltprävention; 3.3 Kinderschutz; 9 Förderlinie; 9.1.3 Ich bin sicher!	Kinderschutz // child protection; Schutzkonzept // protection concept
FALSCH	FALSCH	FALSCH	Allroggen.2017b	Allroggen, Marc; Domann, Sophie; Eßer, Florian; Fegert, Jörg M.; Kampert, Meike; Rau, Thea; Rusack, Tanja; Schloz, Carolin; Schröer, Wolfgang; Strahl, Benjamin; Wolff, Mechthild	Methoden und Vorgehen im Forschungsprojekt		3 Thematischer Fokus; 3.2 Gewaltprävention; 3.3 Kinderschutz; 9 Förderlinie; 9.1.3 Ich bin sicher!	Kinderschutz // child protection; Konzepte, Materialien // concepts; Schutzkonzept // protection concept
FALSCH	FALSCH	FALSCH	Allroggen.2018b	Allroggen, Marc; Jud, Andreas	Häufigkeiten von Übergriffen in Institutionen		2 Institutioneller Kontext; 2.1 Institutionelle Dynamiken; 3 Thematischer Fokus; 3.2 Gewaltprävention; 6 Gewalt; 6.1 Sexueller Missbrauch; 6.2 Übergriff, Peergewalt; 9 Förderlinie; 9.1.16 Sprich mit!	Forschungsergebnisse // research results; Prävalenz // prevalence; Sexualisierte Gewalt // sexual violence; Sexueller Missbrauch // sexual abuse; Survey // survey
FALSCH	FALSCH	FALSCH	Allroggen.2015	Allroggen, Marc; Rau, Thea; Fegert, Jörg M.	Sexuelle Gewalt unter gleichaltrigen Kindern und Jugendlichen		5 Adressat*innen; 5.2 Jugendliche; 6 Gewalt; 6.2 Übergriff, Peergewalt; 9 Förderlinie; 9.1.16 Sprich mit!	Forschungsergebnisse // research results; Peergewalt // peer violence; Sexualisierte Gewalt // sexual violence; Survey // survey
FALSCH	FALSCH	FALSCH	Allroggen.2017d	Allroggen, Marc; Schloz, Carolin; Strahl, Benjamin; Domann, Sophie; Rusack, Tanja	Ergebnisse der Online- und Fragebogenbefragung		3 Thematischer Fokus; 3.2 Gewaltprävention; 3.3 Kinderschutz; 9 Förderlinie; 9.1.3 Ich bin sicher!	Forschungsergebnisse // research results; Kinderschutz // child protection; Schutzkonzept // protection concept; Survey // survey
FALSCH	FALSCH	FALSCH	AmmichtQuinn.2018	Ammicht Quinn, Regina	Trans*zendenz		1 Soziale Rahmung; 1.4 Identitäten; 1.4.1 Geschlecht; 1.4.4 Religion; 2 Institutioneller Kontext; 2.2 Einrichtungen; 2.2.6 Sonstige Einrichtungen	Geschlecht // gender; Kirche // church; Religion // religion; Trans* // trans*
FALSCH	FALSCH	FALSCH	Andresen.2015	Andresen, Sabine	Das Schweigen brechen		1 Soziale Rahmung; 1.1 Diskurse; 1.2 Leitlinien; 6 Gewalt; 6.1 Sexueller Missbrauch	Disclosure // disclosure; Kindeswohl // child welfare; Sexueller Missbrauch // sexual abuse
FALSCH	FALSCH	FALSCH	Andresen.2015b	Andresen, Sabine	Kinderschutz im Alltag		3 Thematischer Fokus; 3.3 Kinderschutz	Kinderschutz // child protection
FALSCH	FALSCH	FALSCH	Andresen.2018b	Andresen, Sabine	Soziale Lebenslagen, Kindeswohlgefährdung und sexuelle Gewalt		1 Soziale Rahmung; 1.4 Identitäten; 1.4.6 Schicht; 3 Thematischer Fokus; 3.2 Gewaltprävention; 6 Gewalt; 6.1 Sexueller Missbrauch	Forschungsergebnisse // research results; Kindeswohl // child welfare; Sexualisierte Gewalt // sexual violence; Soziale Ungleichheit // social inequality
FALSCH	FALSCH	FALSCH	Bower.2018b	Böwer, Michael; Kotthaus, Jochem	Praxisbuch Kinderschutz		3 Thematischer Fokus; 3.3 Kinderschutz	Handbuch // handbook; Institutionelle Dynamiken // institutional dynamics; Kinderschutz // child protection; Kindeswohl // child welfare; Pädagogische Einrichtung // educational facilities; Professionalität // professionality
FALSCH	FALSCH	FALSCH	Arndt.2020b	Arndt, Susan	Sexistische, sexuelle Gewalt		3 Thematischer Fokus; 3.2 Gewaltprävention; 6 Gewalt; 6.1 Sexueller Missbrauch; 6.3 Diskriminierung; 8 Forschung	Diskriminierung // discrimination; Gewalt // violence; Sexualisierte Gewalt // sexual violence
FALSCH	FALSCH	FALSCH	Baader.2015	Baader, Meike Sophia	Vulnerable Kinder in der Moderne in erziehungs- und emotionsgeschichtlicher Perspektive		1 Soziale Rahmung; 1.1 Diskurse; 3 Thematischer Fokus; 3.3 Kinderschutz; 5 Adressat*innen; 5.1 Kinder	Geschichte // history; Kinder // children; Vulnerabilität // vulnerability
FALSCH	FALSCH	FALSCH	Baader.2017	Baader, Meike Sophia	Zwischen Politisierung, Pädosexualität und Befreiung aus dem "Getto der Kindheit"		1 Soziale Rahmung; 1.1 Diskurse; 3 Thematischer Fokus; 3.1 Sexualpädagogik; 6 Gewalt; 6.1 Sexueller Missbrauch	68er // 1960s; Geschichte // history; kindliche Sexualität // childhood sexuality; Pädosexualität // pedosexuality
FALSCH	FALSCH	FALSCH	Baader.2018	Baader, Meike Sophia	Tabubruch und Entgrenzung		1 Soziale Rahmung; 1.1 Diskurse; 2 Institutioneller Kontext; 2.2.5 Hochschule; 4 Fachkräfte; 4.1 Pädagogische Fachkräfte; 6 Gewalt; 6.1 Sexueller Missbrauch	Forschungsergebnisse // research results; Geschichte // history; Pädosexualität // pedosexuality; Sexueller Missbrauch // sexual abuse
FALSCH	FALSCH	FALSCH	Backes.2015	Backes, Susanne	Sexueller Missbrauch in Heimen		2 Institutioneller Kontext; 2.2 Einrichtungen; 2.2.4 Stationäre Einrichtung; 6 Gewalt; 6.1 Sexueller Missbrauch	Forschungsstand // state of research; Sexualisierte Gewalt // sexual violence; Stationäre Einrichtungen // residential care
FALSCH	FALSCH	FALSCH	Bagattini.2015	Bagattini, Alexander	Das Kindeswohl im Konflikt		3 Thematischer Fokus; 3.3 Kinderschutz; 9 Förderlinie; 9.1.7 Kindeswohl als kollektives Orientierungsmuster?	Kindeswohl // child welfare
FALSCH	FALSCH	FALSCH	Ballaschk.2017	Ballaschk, Cindy	Diskurse um Migration, Geschlecht und Sexualität im schulischen Sexualerziehungsunterricht		1 Soziale Rahmung; 1.1 Diskurse; 1.4 Identitäten; 1.4.1 Geschlecht; 1.4.3 Ethnizität; 2 Institutioneller Kontext; 2.2 Einrichtungen; 2.2.3 Weiterführende Schule; 3 Thematischer Fokus; 3.1 Sexualpädagogik	Geschlecht // gender; interkulturell // intercultural; Rassismus // racism; Schule // school; Sexualerziehung // sex ed; Sexualität // sexuality
FALSCH	FALSCH	FALSCH	Bange.2018	Bange, Dirk	Risiko- und Schutzfaktoren in Einrichtungen		2 Institutioneller Kontext; 2.1 Institutionelle Dynamiken; 3 Thematischer Fokus; 3.2 Gewaltprävention; 3.3 Kinderschutz; 6 Gewalt; 6.1 Sexueller Missbrauch	Pädagogische Einrichtung // educational facilities; Risikofaktoren // risk factors; Schutzfaktoren // protection factor; Sexueller Missbrauch // sexual abuse
FALSCH	FALSCH	FALSCH	Bauer.2018b	Bauer, Ullrich; Kolip, Petra; Finne, Emily; Körner, Wilhelm	Prävention von sexualisierter Gewalt in der Schule		2 Institutioneller Kontext; 2.1 Institutionelle Dynamiken; 2.2 Einrichtungen; 2.2.2 Grundschule; 3 Thematischer Fokus; 3.2 Gewaltprävention; 4 Fachkräfte; 4.1 Pädagogische Fachkräfte; 5 Adressat*innen; 5.1 Kinder; 6 Gewalt; 6.2 Übergriff, Peergewalt; 9 Förderlinie; 9.1.4 IGEL	Evaluation // evaluation; Forschungsergebnisse // research results; Grundschule // elementary school; Prävention // prevention; Schule // school; Sexualisierte Gewalt // sexual violence
FALSCH	FALSCH	FALSCH	Baumann.2018	Baumann, Anja Esther; Osterfeld, Margret	Prävention von Folter und Misshandlung		2 Institutioneller Kontext; 2.1 Institutionelle Dynamiken; 3 Thematischer Fokus; 3.2 Gewaltprävention; 3.3 Kinderschutz	Gewalt // violence; Pädagogische Einrichtung // educational facilities; Prävention // prevention; Schutzkonzept // protection concept
FALSCH	FALSCH	FALSCH	BrachesChyrek.2019	Braches-Chyrek, Rita; Kallenbach, Tilman; Müller, Christina; Stahl, Lena	Bildungs- und Teilhabechancen geflüchteter Menschen		1 Soziale Rahmung; 1.1 Diskurse; 4 Fachkräfte; 4.1 Pädagogische Fachkräfte; 4.2 Andere Fachkräfte; 5 Adressat*innen; 5.1 Kinder; 5.2 Jugendliche; 5.3 Eltern und Familie	Beziehungsgestaltung // relationships; Geflüchtete // refugees; Pädagogik // pedagogy; Partizipation // participation; Professionalität // professionality; Professionsethik // professional ethics; Rassismus // racism; Soziale Arbeit // Social Work
FALSCH	FALSCH	FALSCH	Bebermeyer.2018	Bebermeyer, Simone	Biografiearbeit als bedeutsamer therapeutischer Baustein in der Arbeit mit Kindern und Jugendlichen, die sexualisierte Gewalt gegen ihre Geschwister ausgeübt haben		3 Thematischer Fokus; 3.2 Gewaltprävention; 4 Fachkräfte; 4.2 Andere Fachkräfte; 6 Gewalt; 6.2 Übergriff, Peergewalt	Biographieforschung // biographical research; Geschwister // siblings; jugendliche Täter*innen // youth offenders; Sexualisierte Gewalt // sexual violence
FALSCH	FALSCH	FALSCH	Becker.2017	Becker, Sophinette	Aktuelle Diskurse über Pädosexualität/Pädophilie und ihre Leerstellen		1 Soziale Rahmung; 1.1 Diskurse; 6 Gewalt; 6.1 Sexueller Missbrauch	Diskurs // discourse; Pädosexualität // pedosexuality
FALSCH	FALSCH	FALSCH	Behnisch.2018	Behnisch, Michael; Schäfer, Dorothee	Sexualisierte Gewalt und der Umgang mit Sexualität in der Heimerziehung		2 Institutioneller Kontext; 2.2 Einrichtungen; 2.2.4 Stationäre Einrichtung; 3 Thematischer Fokus; 3.2 Gewaltprävention; 6 Gewalt; 6.2 Übergriff, Peergewalt; 7 Sexualität; 7.1 Sexuelle Erfahrungen; 9 Förderlinie; 9.2.8 PISUM	Einzelinterviews // one-on-one interviews; Forschungsergebnisse // research results; Jugendliche // youth; Kinder- und Jugendhilfe // child welfare system; Sexualisierte Gewalt // sexual violence; Sexualität // sexuality; Stationäre Einrichtungen // residential care
FALSCH	FALSCH	FALSCH	Berger.2015	Berger, Ernst	Gewalt in pädagogischen Institutionen in Österreich		2 Institutioneller Kontext; 2.1 Institutionelle Dynamiken; 3 Thematischer Fokus; 3.2 Gewaltprävention; 6 Gewalt; 6.2 Übergriff, Peergewalt	Forschungsstand // state of research; Pädagogische Einrichtung // educational facilities; Sexualisierte Gewalt // sexual violence
FALSCH	FALSCH	FALSCH	Beuster.2019	Beuster, Catharina; Neu, Regina; Strachwitz, Louisa; Weiler, Julia von	»Stoppt Sharegewalt!«		1 Soziale Rahmung; 1.2 Leitlinien; 1.3 Medien und Technologie; 6 Gewalt; 6.1 Sexueller Missbrauch	Digitale Medien // digital media; Prävention // prevention; Praxis // practice; Professionalität // professionality; Sexualisierte Gewalt // sexual violence
FALSCH	FALSCH	FALSCH	Biedermann.2018	Biedermann, Sarah Violetta	Sexuelle Funktionsstörungen nach Traumatisierung		4 Fachkräfte; 4.2 Andere Fachkräfte; 6 Gewalt; 6.5 Negative Folgen	Langzeitfolgen // long-term effect; Psychotherapie // psychotherapy; Sexualisierte Gewalt // sexual violence; Trauma // trauma
FALSCH	FALSCH	FALSCH	Biedermann.2018b	Biedermann, Sarah Violetta; Signerski-Krieger, Jörg	Sexualpsychotherapie nach dem »Hamburger Modell« bei Traumafolgestörungen		4 Fachkräfte; 4.2 Andere Fachkräfte; 6 Gewalt; 6.2 Übergriff, Peergewalt; 6.5 Negative Folgen	Psychotherapie // psychotherapy; Sexualisierte Gewalt // sexual violence; Sexualität // sexuality; Trauma // trauma
FALSCH	FALSCH	FALSCH	Bienstein.2018	Bienstein, Pia; Urbann, Katharina; Scharmanski, Sara; Verlinden, Karla	Prävention sexuellen Missbrauchs an Kindern und Jugendlichen mit Behinderung		1 Soziale Rahmung; 1.4 Identitäten; 1.4.5 Behinderungen; 2 Institutioneller Kontext; 2.2 Einrichtungen; 2.2.6 Sonstige Einrichtungen; 3 Thematischer Fokus; 3.2 Gewaltprävention; 4 Fachkräfte; 4.1 Pädagogische Fachkräfte; 6 Gewalt; 6.1 Sexueller Missbrauch; 9 Förderlinie; 9.1.14 SeMB	Evaluation // evaluation; Forschungsergebnisse // research results; Menschen mit Behinderungen // people with disabilities; Pädagogische Fachkräfte // pedagogial staff; Prävention // prevention; Sexueller Missbrauch // sexual abuse
FALSCH	FALSCH	FALSCH	Bienstein.2018c	Bienstein, Pia; Verlinden, Karla	Behindertenhilfe als Ort sexualisierter Gewalt		1 Soziale Rahmung; 1.4 Identitäten; 1.4.5 Behinderungen; 3 Thematischer Fokus; 3.2 Gewaltprävention; 4 Fachkräfte; 4.1 Pädagogische Fachkräfte; 6 Gewalt; 6.1 Sexueller Missbrauch; 9 Förderlinie; 9.1.14 SeMB	Menschen mit Behinderungen // people with disabilities; Sexualisierte Gewalt // sexual violence
FALSCH	FALSCH	FALSCH	Bischof.2018	Bischof, Karoline	Sexocorporel-Sexualtherapie nach sexuellen Gewalterfahrungen		3 Thematischer Fokus; 3.4 Intervention; 6 Gewalt; 6.2 Übergriff, Peergewalt; 6.5 Negative Folgen	Psychotherapie // psychotherapy; Sexualisierte Gewalt // sexual violence; Sexualität // sexuality
FALSCH	FALSCH	FALSCH	BrachesChyrek.2017	Braches-Chyrek, Rita; Sünker, Heinz	Soziale Arbeit in gesellschaftlichen Konflikten und Kämpfen		1 Soziale Rahmung; 1.1 Diskurse; 3.5 Praxismaterialien	Gesellschaft // society; Konzepte, Materialien // concepts; Soziale Arbeit // Social Work; Soziale Ungleichheit // social inequality; Sozialwissenschaften // social sciences; Theorie // theory
FALSCH	FALSCH	FALSCH	Bittner.2018	Bittner, Martin; Wittfeld, Meike	Sichere Räume		1 Soziale Rahmung; 1.1 Diskurse; 2 Institutioneller Kontext; 2.1 Institutionelle Dynamiken; 3 Thematischer Fokus; 3.2 Gewaltprävention; 6 Gewalt; 6.1 Sexueller Missbrauch	Ethnographie // ethnography; Forschungsergebnisse // research results; Pädagogische Einrichtung // educational facilities; Schutzfaktoren // protection factor; Sexueller Missbrauch // sexual abuse
FALSCH	FALSCH	FALSCH	Blattner.2018	Blättner, Beate; Schultes, Kristin; Hintz, Elisabeth	Dating Violence		5 Adressat*innen; 5.2 Jugendliche; 6 Gewalt; 6.2 Übergriff, Peergewalt; 7 Sexualität; 7.2 Beziehungsgestaltung	Einzelinterviews // one-on-one interviews; Forschungsergebnisse // research results; Jugendliche // youth; Peergewalt // peer violence; Sexualisierte Gewalt // sexual violence
FALSCH	FALSCH	FALSCH	Blumenthal.2015	Blumenthal, Sara	Sexuelle Diversität als Schamgrenze der Sexualaufklärung im Biologieunterricht!?		2 Institutioneller Kontext; 2.2 Einrichtungen; 2.2.3 Weiterführende Schule; 3 Thematischer Fokus; 3.1 Sexualpädagogik; 4 Fachkräfte; 4.1 Pädagogische Fachkräfte; 7 Sexualität; 7.3 Sexuelle Selbstbestimmung	Scham // shame; Schule // school; Sexualerziehung // sex ed; Sexuelle Vielfalt // sexual diversity
FALSCH	FALSCH	FALSCH	Bodeker.2016	Bödeker, Heike	Intersexualität, Individualität, Selbstbestimmtheit und Psychoanalyse		1 Soziale Rahmung; 1.4 Identitäten; 1.4.1 Geschlecht; 3 Thematischer Fokus; 3.1 Sexualpädagogik; 7 Sexualität; 7.3 Sexuelle Selbstbestimmung	Intergeschlechtlichkeit // intersexuality
FALSCH	FALSCH	FALSCH	Borgwardt.2018	Borgwardt, Kirsten	So viel wie nötig - so wenig wie möglich?		3 Thematischer Fokus; 3.4 Intervention; 6 Gewalt; 6.2 Übergriff, Peergewalt	Geschwister // siblings; jugendliche Täter*innen // youth offenders; Langzeitfolgen // long-term effect; Sexualisierte Gewalt // sexual violence
FALSCH	FALSCH	FALSCH	Bower.2018	Böwer, Michael	Schutz und Sicherheit in Organisationen für Kinder		2 Institutioneller Kontext; 2.1 Institutionelle Dynamiken; 3 Thematischer Fokus; 3.2 Gewaltprävention; 3.3 Kinderschutz; 5 Adressat*innen; 5.1 Kinder	Kinder // children; Pädagogische Einrichtung // educational facilities; Schutzfaktoren // protection factor
FALSCH	FALSCH	FALSCH	Brachmann.2016	Brachmann, Jens	Die Aufarbeitung der Vorkommnisse sexualisierter Gewalt an der Odenwaldschule		2 Institutioneller Kontext; 2.1 Institutionelle Dynamiken; 2.2 Einrichtungen; 2.2.3 Weiterführende Schule; 2.2.6 Sonstige Einrichtungen; 6 Gewalt; 6.4 Disclosure, Aufarbeitung	Disclosure // disclosure; Institutionelle Dynamiken // institutional dynamics; Odenwaldschule // Odenwaldschule; Sexualisierte Gewalt // sexual violence; Sexueller Missbrauch // sexual abuse
FALSCH	FALSCH	FALSCH	Brandl.2018	Brandl, Sarah Yvonne; Vogelsang, Verena; Bäumer, Ewa; Schneider, Nadine	Präventionsmaterialien		3 Thematischer Fokus; 3.2 Gewaltprävention; 3.5 Praxismaterialien; 9 Förderlinie; 9.1.9 Präventionsmaterialien	Kinder // children; Konzepte, Materialien // concepts; Prävention // prevention; Sexualisierte Gewalt // sexual violence; Theorie // theory
FALSCH	FALSCH	FALSCH	Brodersen.2016	Brodersen, Folke; Volpers, Simon	"Rosa Hemden tragen nur Homos"		1 Soziale Rahmung; 1.4 Identitäten; 1.4.1 Geschlecht; 1.4.2 LGBAQ*; 2 Institutioneller Kontext; 2.2 Einrichtungen; 2.2.5 Hochschule; 3 Thematischer Fokus; 3.1 Sexualpädagogik	Geschlecht // gender; Heteronormativität // heteronormativity; Hochschule, Universität // college, university; Intersektionalität // intersectionality; Sexualisierte Gewalt // sexual violence; Studierende // students
FALSCH	FALSCH	FALSCH	Bruckner.2017	Brückner, Margrit	Brüche und Kontinuitäten		1 Soziale Rahmung; 1.1 Diskurse; 3 Thematischer Fokus; 3.1 Sexualpädagogik; 4 Fachkräfte; 4.1 Pädagogische Fachkräfte	Liebe // love; Sexualität // sexuality; Soziale Arbeit // Social Work
FALSCH	FALSCH	FALSCH	Brachmann.2019	Brachmann, Jens	Tatort Odenwaldschule		1 Soziale Rahmung; 1.1 Diskurse; 2 Institutioneller Kontext; 2.1 Institutionelle Dynamiken; 2.2 Einrichtungen; 2.2.3 Weiterführende Schule; 3 Thematischer Fokus; 3.3 Kinderschutz; 6 Gewalt; 6.1 Sexueller Missbrauch; 6.4 Disclosure, Aufarbeitung; 6.5 Negative Folgen; 9 Förderlinie; 9.2.1 Auf-Wirkung	Aufarbeitung // rehabilitation; Betroffene sexualisierter Gewalt // sexual assault survivors; Disclosure // disclosure; Diskurs // discourse; Forschungspraxis // research practice; Forschungsstand // state of research; Geschichte // history; Jugendliche // youth; Jungen // boys; Kinder // children; Kinderschutz // child protection; Kindeswohl // child welfare; Kirche // church; Langzeitfolgen // long-term effect; Macht // power; Normen // norms; Odenwaldschule // Odenwaldschule; Organisationskultur // organisational culture; Pädagogik // pedagogy; Pädagogische Einrichtung // educational facilities; Religion // religion; Risikofaktoren // risk factors; Sexueller Missbrauch // sexual abuse; Täter*in // offender
