FALSCH	FALSCH	FALSCH	Henningsen.2018	Henningsen, Anja; List, Inga Marie	Das ist ja meistens nur Geschnacke	Kindesmisshandlung und -vernachlässigung	2 Institutioneller Kontext; 2.1 Institutionelle Dynamiken; 2.2 Einrichtungen; 2.2.4 Stationäre Einrichtung; 3 Thematischer Fokus; 3.1 Sexualpädagogik; 4 Fachkräfte; 4.1 Pädagogische Fachkräfte; 9 Förderlinie; 9.3.4 Junprof Kiel	Achtsamkeit // awareness; Einzelinterviews // one-on-one interviews; Forschungsergebnisse // research results; Kinder- und Jugendhilfe // child welfare system; Pädagogische Fachkräfte // pedagogial staff; Sexualität // sexuality; Sexualkultur // sexuality culture; Stationäre Einrichtungen // residential care
FALSCH	FALSCH	FALSCH	Henningsen.2015b	Henningsen, Anja; Mantey, Dominik	Sexualpädagogik verletzt Grenzen? Sexualpädagogik wahrt Grenzen!	Forum Erziehungshilfen	3 Thematischer Fokus; 3.1 Sexualpädagogik; 9 Förderlinie; 9.3.4 Junprof Kiel	Grenzen // boundaries; Pädagogische Fachkräfte // pedagogial staff; Professionalität // professionality; Sexualpädagogik // sex education
FALSCH	FALSCH	FALSCH	Henningsen.2016f	Henningsen, Anja; Tuider, Elisabeth; Timmermanns, Stefan	Sexualpädagogik kontrovers		3 Thematischer Fokus; 3.1 Sexualpädagogik; 9 Förderlinie; 9.3.4 Junprof Kiel	Sexualpädagogik // sex education
FALSCH	FALSCH	FALSCH	HerreraVivar.2016	Herrera Vivar, María Teresa; Rostock, Petra; Schirmer, Uta; Wagels, Karen	Über Heteronormativität		1 Soziale Rahmung; 1.1 Diskurse; 1.4 Identitäten; 1.4.2 LGBAQ*; 3 Thematischer Fokus; 3.1 Sexualpädagogik; 3.2 Gewaltprävention; 6 Gewalt; 6.3 Diskriminierung	Geschlecht // gender; Heteronormativität // heteronormativity
FALSCH	FALSCH	FALSCH	Baader.2017b	Baader, Meike Sophia; Jansen, Christian; König, Julia; Sager, Christin	Tabubruch und Entgrenzung		1 Soziale Rahmung; 1.1 Diskurse; 3 Thematischer Fokus; 3.1 Sexualpädagogik; 6 Gewalt; 6.1 Sexueller Missbrauch	68er // 1960s; Geschichte // history; kindliche Sexualität // childhood sexuality; Pädosexualität // pedosexuality
FALSCH	FALSCH	FALSCH	Heser.2020	Heser, Thomas	Schutz vor Gewalt in Unterkünften für Geflüchtete. (Wie) kann Prävention gelingen?	Migration und soziale Arbeit	2 Institutioneller Kontext; 2.1 Institutionelle Dynamiken; 2.2 Einrichtungen; 2.2.6 Sonstige Einrichtungen; 3 Thematischer Fokus; 3.2 Gewaltprävention	Geflüchtete // refugees; Prävention // prevention; Rassismus // racism; Risikofaktoren // risk factors; Schutzfaktoren // protection factor; Schutzkonzept // protection concept; Sexualisierte Gewalt // sexual violence; Sexualisierung // sexualisation
FALSCH	FALSCH	FALSCH	Hess.2017	Hess, Johanna	Zwischen Sorge und Selbstsorge	Soziale Passagen	3 Thematischer Fokus; 3.2 Gewaltprävention; 3.4 Intervention; 4 Fachkräfte; 4.1 Pädagogische Fachkräfte; 6 Gewalt; 6.4 Disclosure, Aufarbeitung; 9 Förderlinie; 9.3.3 Junprof Kassel	Bewältigung // coping; Kinder- und Jugendhilfe // child welfare system; Pädagogische Fachkräfte // pedagogial staff; Sexualisierte Gewalt // sexual violence
FALSCH	FALSCH	FALSCH	Hess.2016	Hess, Johanna; Retkowski, Alexandra; Wehrhahn, Dominik	Küssen, Streicheln, Doktorspiele ...	Forum Gemeindepsychologie	3 Thematischer Fokus; 3.1 Sexualpädagogik; 3.2 Gewaltprävention; 4 Fachkräfte; 4.1 Pädagogische Fachkräfte; 9 Förderlinie; 9.3.3 Junprof Kassel	Beziehungsgestaltung // relationships; Biographieforschung // biographical research; Diskurs // discourse; Einzelinterviews // one-on-one interviews; Forschungsergebnisse // research results; kindliche Sexualität // childhood sexuality; Pädagogik // pedagogy; Pädagogische Fachkräfte // pedagogial staff; Professionalität // professionality; Professionsethik // professional ethics; Qualitative Forschung // qualitative research; Quantitative Forschung // quantitative research; Sexualität // sexuality; Soziale Arbeit // Social Work; Survey // survey
FALSCH	FALSCH	FALSCH	Heling.2015	Heßling, Angelika; Bode, Heidrun	Erfahrungen sexualisierter Gewalt	BZgA Forum	3 Thematischer Fokus; 3.1 Sexualpädagogik; 3.2 Gewaltprävention; 5 Adressat*innen; 5.2 Jugendliche; 6 Gewalt; 6.2 Übergriff, Peergewalt; 7 Sexualität; 7.1 Sexuelle Erfahrungen	Betroffene sexualisierter Gewalt // sexual assault survivors; Forschungsergebnisse // research results; Jugendliche // youth; Jugendsexualität // youth sexuality; Quantitative Forschung // quantitative research; Sexualisierte Gewalt // sexual violence; Survey // survey
FALSCH	FALSCH	FALSCH	Hoblich.2017	Höblich, Davina	Sexuelle und geschlechtliche Vielfalt	Sozial Extra (Sozial Extra)	1 Soziale Rahmung; 1.4 Identitäten; 1.4.1 Geschlecht; 1.4.2 LGBAQ*; 3 Thematischer Fokus; 3.1 Sexualpädagogik	Asexualität // asexuality; Bisexualität // bisexuality; Coming out // coming out; Diversität // diversity; Gender Studies // Gender Studies; Geschlecht // gender; Heteronormativität // heteronormativity; Homosexualität // homosexuality; Intergeschlechtlichkeit // intersexuality; Queer Theorie // Queer Theory; Queerness // Queerness; Sexuelle Vielfalt // sexual diversity; Trans* // trans*
FALSCH	FALSCH	FALSCH	Hoblich.2017b	Höblich, Davina; Kellermann, Anna	Sexuelle Orientierung (k)ein Thema in der Kinder- und Jugendhilfe (SeKiJu) –	Soziale Passagen	1 Soziale Rahmung; 1.4 Identitäten; 1.4.2 LGBAQ*; 2 Institutioneller Kontext; 2.2 Einrichtungen; 2.2.4 Stationäre Einrichtung; 2.2.6 Sonstige Einrichtungen; 3 Thematischer Fokus; 3.1 Sexualpädagogik	Kinder- und Jugendhilfe // child welfare system; Sexuelle Orientierung // sexual orientation; Sexuelle Vielfalt // sexual diversity; Stationäre Einrichtungen // residential care
FALSCH	FALSCH	FALSCH	HochschuleMerseburg.2015	Hochschule Merseburg	Forschungsbericht 2015		8 Forschung; 9 Förderlinie; 9.3.1 Forschungsprof Merseburg	Forschungsstand // state of research; Kinder- und Jugendhilfe // child welfare system; Sexuelle Bildung // sexuality education; Trauma // trauma
FALSCH	FALSCH	FALSCH	Hoffmann.2015	Hoffmann, Markus	Schulische Sexualerziehung		2 Institutioneller Kontext; 2.2 Einrichtungen; 2.2.3 Weiterführende Schule; 3 Thematischer Fokus; 3.1 Sexualpädagogik; 4 Fachkräfte; 4.1 Pädagogische Fachkräfte	Kommunikation // communication; Lehrer*innen // Teachers; Schule // school; Sexualerziehung // sex ed; Sexualität // sexuality; Sexualkultur // sexuality culture
FALSCH	FALSCH	FALSCH	Hofherr.2017	Hofherr, Stefan	Wissen von Schülerinnen und Schülern über sexuelle Gewalt in pädagogischen Kontexten		2 Institutioneller Kontext; 2.2 Einrichtungen; 2.2.3 Weiterführende Schule; 3 Thematischer Fokus; 3.2 Gewaltprävention; 5 Adressat*innen; 5.2 Jugendliche	Forschungsergebnisse // research results; Forschungsstand // state of research; Organisationskultur // organisational culture; Schüler*innen // pupils; Sexualisierte Gewalt // sexual violence
FALSCH	FALSCH	FALSCH	Hofherr.2018d	Hofherr, Stefan; Kindler, Heinz	Wie Jugendliche auf miterlebte Situationen sexueller Gewalt reagieren	ZSE (Zeitschrift für Soziologie der Erziehung und Sozialisation)	2 Institutioneller Kontext; 2.2 Einrichtungen; 2.2.3 Weiterführende Schule; 3 Thematischer Fokus; 3.2 Gewaltprävention; 5 Adressat*innen; 5.2 Jugendliche; 6 Gewalt; 6.2 Übergriff, Peergewalt; 9 Förderlinie; 9.1.17 Wissen von Schülerinnen und Schülern	Forschungsergebnisse // research results; Peergewalt // peer violence; Quantitative Forschung // quantitative research; Schule // school; Schüler*innen // pupils; Sexualisierte Gewalt // sexual violence; Survey // survey
FALSCH	FALSCH	FALSCH	Baader.2021	Baader, Meike Sophia; Sager, Christin	Pädagogische Professionalität und Reflexivität im Umgang mit Gewalt und sexualisierter Gewalt in Macht-, Geschlechter- und Sorgeverhältnissen		1 Soziale Rahmung; 1.1 Diskurse; 4 Fachkräfte; 4.1 Pädagogische Fachkräfte; 4.2 Andere Fachkräfte; 6 Gewalt; 6.1 Sexueller Missbrauch; 6.3 Diskriminierung; 6.4 Disclosure, Aufarbeitung; 6.5 Negative Folgen; 8 Forschung	Macht // power; Pädagogik // pedagogy; Pädagogische Beziehung // pedagogical relationship; Professionalität // professionality; Sexuelle Belästigung // sexual harassment; Sexueller Missbrauch // sexual abuse
FALSCH	FALSCH	FALSCH	Hofmann.2017	Hofmann, Holger	Die Rechte von Kindern nach der UN-Kinderrechtskonvention, ihre Bekanntheit und Bedeutung für die Kinder- und Jugendhilfe	UJ (unsere jugend)	1 Soziale Rahmung; 1.1 Diskurse; 2 Institutioneller Kontext; 2.1 Institutionelle Dynamiken; 2.2 Einrichtungen; 2.2.4 Stationäre Einrichtung; 3 Thematischer Fokus; 3.3 Kinderschutz; 3.4 Intervention; 5 Adressat*innen; 5.1 Kinder	Jugendliche // youth; Kinder // children; Kinder- und Jugendhilfe // child welfare system; Kinderschutz // child protection; Kindeswohl // child welfare; Menschenrechte // human rights; Normen // norms; Recht // law; Stationäre Einrichtungen // residential care
FALSCH	FALSCH	FALSCH	Hofstatter.2020	Hofstätter, Christine	Sexuelle Selbstbestimmung durch Körperbewusstsein in der sexuellen Bildung von Kindern und Jugendlichen	Zeitschrift für Individualpsychologie	3 Thematischer Fokus; 3.1 Sexualpädagogik; 5 Adressat*innen; 5.2 Jugendliche; 7 Sexualität; 7.3 Sexuelle Selbstbestimmung	Jugendliche // youth; Kinder // children; Körper // body; Pädagogik // pedagogy; Prävention // prevention; Praxis // practice; Selbstbestimmung // agency; Sexualpädagog*innen // sex educators; Sexualpädagogik // sex education; Sexuelle Bildung // sexuality education; Soziale Arbeit // Social Work
FALSCH	FALSCH	FALSCH	Hopfner.2018	Höpfner, Ulf; Lotz, Alexander	Eine professionelle Haltung zur Akzeptanz von Vielfalt entwickeln	Pädagogik	1 Soziale Rahmung; 1.4 Identitäten; 1.4.2 LGBAQ*; 2 Institutioneller Kontext; 2.2 Einrichtungen; 2.2.3 Weiterführende Schule; 3 Thematischer Fokus; 3.1 Sexualpädagogik; 4 Fachkräfte; 4.1 Pädagogische Fachkräfte	Haltung // attitude; Lehrer*innen // Teachers; Professionalität // professionality; Schule // school; Sexuelle Vielfalt // sexual diversity
FALSCH	FALSCH	FALSCH	Horten.2021	Horten, Barbara	Sexuelle Gewalt unter altersgleichen Kindern und Jugendlichen		1 Soziale Rahmung; 1.1 Diskurse; 2 Institutioneller Kontext; 2.1 Institutionelle Dynamiken; 2.2 Einrichtungen; 3 Thematischer Fokus; 3.2 Gewaltprävention; 4 Fachkräfte; 4.1 Pädagogische Fachkräfte; 4.2 Andere Fachkräfte; 5 Adressat*innen; 5.1 Kinder; 5.2 Jugendliche; 6 Gewalt; 6.1 Sexueller Missbrauch; 6.2 Übergriff, Peergewalt	Forschungsergebnisse // research results; Jugendliche // youth; Kinder // children; Prävalenz // prevalence; Quantitative Forschung // quantitative research; Resilienz // resilience; Reviktimisierung // revictimization; Sexualisierte Gewalt // sexual violence
FALSCH	FALSCH	WAHR	Huch.2015	Huch, Sarah; Lücke, Martin	Sexuelle Vielfalt im Handlungsfeld Schule		1 Soziale Rahmung; 1.4 Identitäten; 1.4.1 Geschlecht; 1.4.2 LGBAQ*; 2 Institutioneller Kontext; 2.2 Einrichtungen; 2.2.3 Weiterführende Schule; 3 Thematischer Fokus; 3.1 Sexualpädagogik; 3.5 Praxismaterialien; 4 Fachkräfte; 4.1 Pädagogische Fachkräfte	Diversität // diversity; Konzepte, Materialien // concepts; Schule // school
FALSCH	FALSCH	FALSCH	Hugel.2017	Hügel, Martin	Jugendgewalt und Medienwirkung	Sozial Extra (Sozial Extra)	1 Soziale Rahmung; 1.1 Diskurse; 1.3 Medien und Technologie; 6 Gewalt; 6.1 Sexueller Missbrauch; 6.2 Übergriff, Peergewalt; 6.5 Negative Folgen	Digitale Medien // digital media; Gewalt // violence; Jugendliche // youth; jugendliche Täter*innen // youth offenders; junge Erwachsene // young adults; Medien // media; Prävention // prevention; Professionalität // professionality; Risikofaktoren // risk factors; Schutzfaktoren // protection factor
FALSCH	FALSCH	FALSCH	Hundt.2016	Hundt, Marion	Kinderschutz in der Schule		2 Institutioneller Kontext; 2.2 Einrichtungen; 2.2.3 Weiterführende Schule; 3 Thematischer Fokus; 3.3 Kinderschutz; 6 Gewalt; 6.4 Disclosure, Aufarbeitung	Aufarbeitung // rehabilitation; Disclosure // disclosure; Fachberatungsstelle // specialist counselling; Institutionelle Dynamiken // institutional dynamics; Institutioneller Missbrauch // institutional abuse; Kinderschutz // child protection; Kooperation // cooperation; Lehrer*innen // Teachers; Normen // norms; Prävention // prevention; Professionalität // professionality; Professionsethik // professional ethics; Recht // law; Risikofaktoren // risk factors; Schule // school; Schüler*innen // pupils; Schutzfaktoren // protection factor; Sexualisierte Gewalt // sexual violence; Sexueller Missbrauch // sexual abuse
FALSCH	FALSCH	FALSCH	Hunger.2017	Hunger, Ina; Böhlke, Nicola	Über die Grenzen von Scham. Eine qualitative Studie zu (scham-) grenzüberschreitenden Situationen im Sportunterricht aus der Perspektive von Schüler/innen		1 Soziale Rahmung; 1.1 Diskurse; 2 Institutioneller Kontext; 2.2 Einrichtungen; 2.2.3 Weiterführende Schule; 3 Thematischer Fokus; 3.1 Sexualpädagogik; 3.2 Gewaltprävention; 8 Forschung	Forschungsergebnisse // research results; Grenzen // boundaries; Jugendarbeit // youth work; Lehrer*innen // Teachers; Qualitative Analyse // qualitative analysis; Scham // shame; Schule // school; Schüler*innen // pupils; Sport // sports
WAHR	FALSCH	FALSCH	Husmann.2020	Husmann, Laura; Rusack, Tanja	Schutzkonzepte in der Pflegekinderhilfe	Sozial Extra	1 Soziale Rahmung; 1.1 Diskurse; 1.2 Leitlinien; 3 Thematischer Fokus; 3.2 Gewaltprävention; 4 Fachkräfte; 4.1 Pädagogische Fachkräfte; 4.2 Andere Fachkräfte; 5 Adressat*innen; 5.1 Kinder; 5.2 Jugendliche; 5.3 Eltern und Familie; 6 Gewalt; 6.1 Sexueller Missbrauch; 8 Forschung; 9 Förderlinie; 9.2.3 FosterCare	Familie // family; Institutionelle Dynamiken // institutional dynamics; Organisationskultur // organisational culture; Pädagogik // pedagogy; Pflegekinderhilfe // foster care; Risikofaktoren // risk factors; Schutzfaktoren // protection factor; Schutzkonzept // protection concept; Soziale Arbeit // Social Work
FALSCH	FALSCH	FALSCH	Huxoll.2016	Huxoll, Martina; Frings, Rebecca; Kanber, Eda	Elternkompass		2 Institutioneller Kontext; 2.2 Einrichtungen; 2.2.6 Sonstige Einrichtungen; 3 Thematischer Fokus; 3.2 Gewaltprävention; 3.3 Kinderschutz; 3.5 Praxismaterialien; 5 Adressat*innen; 5.3 Eltern und Familie	Eltern // parents; Handlungsempfehlungen // guidelines; Konzepte, Materialien // concepts; Schutzkonzept // protection concept; Sexueller Missbrauch // sexual abuse; Sport // sports
FALSCH	FALSCH	FALSCH	Baader.2019	Baader, Meike Sophia; Scheiwe, Kirsten	Erziehung und Schule nach 68	Sozial Extra (Sozial Extra)	1 Soziale Rahmung; 1.1 Diskurse; 2 Institutioneller Kontext; 2.1 Institutionelle Dynamiken; 2.2 Einrichtungen; 2.2.1 Kita; 2.2.2 Grundschule; 2.2.3 Weiterführende Schule	68er // 1960s; Geschichte // history; Pädagogik // pedagogy; Pädagogische Beziehung // pedagogical relationship; Pädagogische Einrichtung // educational facilities; Schule // school; Schüler*innen // pupils
FALSCH	FALSCH	FALSCH	Hyde.2020	Hyde, Lisa-Marie	Begünstigt visuelle Gewalt in Computerspielen die Gewalttätigkeit von Jugendlichen?		1 Soziale Rahmung; 1.3 Medien und Technologie; 5 Adressat*innen; 5.2 Jugendliche; 6 Gewalt; 6.5 Negative Folgen	Aggression // aggression; Bedarfe // needs; Diagnostik // diagnostics; Digitale Medien // digital media; Gesundheit // health; Gewalt // violence; Grenzen // boundaries; Jugendliche // youth; jugendliche Täter*innen // youth offenders; junge Erwachsene // young adults; Medien // media
FALSCH	FALSCH	FALSCH	InternationaleGesellschaftfurerzieherischeHilfene.V..2018	Internationale Gesellschaft für erzieherische Hilfen e.V.	Rechte haben - Recht kriegen		2 Institutioneller Kontext; 2.2 Einrichtungen; 2.2.4 Stationäre Einrichtung; 3 Thematischer Fokus; 3.3 Kinderschutz	Jugendamt // child welfare services; Jugendliche // youth; junge Erwachsene // young adults; Kinder // children; Kinder- und Jugendhilfe // child welfare system; Menschenrechte // human rights; Partizipation // participation; Recht // law
FALSCH	FALSCH	FALSCH	Iselhorst.2016	Iselhorst, Anna-Lena	Der Berliner Notdienst Kinderschutz (BNK). Krisenintervention rund um die Uhr	UJ (unsere jugend)	3 Thematischer Fokus; 3.3 Kinderschutz; 3.5 Praxismaterialien; 5 Adressat*innen; 5.1 Kinder	Gewalt // violence; Intervention // intervention; Kinderschutz // child protection; Kommunikation // communication; Konzepte, Materialien // concepts; Kooperation // cooperation; Praxis // practice; Raum // space; Vulnerabilität // vulnerability
FALSCH	FALSCH	FALSCH	Jagusch.2015	Jagusch, Birgit	Migrations- und Diversitätssensibilität im Kinderschutz	Kinder- und Jugendschutz in Wissenschaft und Praxis	3 Thematischer Fokus; 3.3 Kinderschutz	Diversität // diversity; Kinderschutz // child protection; Konzepte, Materialien // concepts; Praxis // practice; Rassismus // racism
WAHR	FALSCH	FALSCH	Jentsch.2020	Jentsch, Birgit; Schnock, Brigitte	Kinder im Blick? Kindeswohl in Zeiten von Corona	Sozial Extra (Sozial Extra)	3 Thematischer Fokus; 3.3 Kinderschutz	Corona // corona; Kinder // children; Kinderschutz // child protection; Kindeswohl // child welfare
FALSCH	FALSCH	FALSCH	Jestadt.2020	Jestädt, Hannah	Erfahrungen mit Sexualität bei Jungen und Mädchen im ländlichen Raum	Deutsche Jugend	1 Soziale Rahmung; 1.1 Diskurse; 1.4 Identitäten; 1.4.1 Geschlecht; 7 Sexualität; 7.1 Sexuelle Erfahrungen; 7.2 Beziehungsgestaltung; 7.3 Sexuelle Selbstbestimmung	Forschungspraxis // research practice; Jungen // boys; Mädchen // girls; Raum // space; Selbstbestimmung // agency; Sexualität // sexuality
FALSCH	FALSCH	FALSCH	Jud.2016	Jud, Andreas; Rassenhofer, Miriam; Witt, Andreas; Münzer, Annika; Fegert, Jörg M.	Häufigkeitsangaben zum sexuellen Missbrauch		3 Thematischer Fokus; 3.2 Gewaltprävention; 6 Gewalt; 6.1 Sexueller Missbrauch; 8 Forschung; 9 Förderlinie; 9.1.3 Ich bin sicher!	Forschungsstand // state of research; Prävalenz // prevalence; Sexueller Missbrauch // sexual abuse
FALSCH	FALSCH	FALSCH	Kadera.2018	Kadera, Stepanka	Kindeswohl und sexualisierte Gewalt in pädagogischen Einrichtungen	Bildungsforschung	2 Institutioneller Kontext; 2.1 Institutionelle Dynamiken; 3 Thematischer Fokus; 3.2 Gewaltprävention; 4 Fachkräfte; 4.1 Pädagogische Fachkräfte; 9 Förderlinie; 9.1.7 Kindeswohl als kollektives Orientierungsmuster?	Forschungsergebnisse // research results; Kindeswohl // child welfare; Pädagogische Einrichtung // educational facilities; Pädagogische Fachkräfte // pedagogial staff; Qualitative Analyse // qualitative analysis; Sexualisierte Gewalt // sexual violence
FALSCH	FALSCH	FALSCH	Kahl.2016	Kahl, Werner	Die Bedeutung des interkulturellen und interreligiösen Dialogs für die Sexualaufklärung	BZgA Forum	1 Soziale Rahmung; 1.1 Diskurse; 1.4 Identitäten; 1.4.4 Religion; 3 Thematischer Fokus; 3.1 Sexualpädagogik	interkulturell // intercultural; Religion // religion; Sexualerziehung // sex ed
FALSCH	FALSCH	FALSCH	Kampert.2015	Kampert, Meike	„Unser Schutzkonzept ist in einem Ordner, ich weiß aber nicht, wo der gerade steht“	Sozial Extra	1 Soziale Rahmung; 1.1 Diskurse; 2 Institutioneller Kontext; 2.1 Institutionelle Dynamiken; 3 Thematischer Fokus; 3.2 Gewaltprävention; 3.3 Kinderschutz; 4 Fachkräfte; 4.1 Pädagogische Fachkräfte; 4.2 Andere Fachkräfte; 8 Forschung; 9 Förderlinie; 9.1.3 Ich bin sicher!	Forschungsergebnisse // research results; Nähe-Distanz-Regulation // boundary management; Organisationskultur // organisational culture; Pädagogische Einrichtung // educational facilities; Pädagogische Fachkräfte // pedagogial staff; Partizipation // participation; Prävention // prevention; Praxis // practice; Risikofaktoren // risk factors; Schutzfaktoren // protection factor; Schutzkonzept // protection concept; Sexualisierte Gewalt // sexual violence
FALSCH	FALSCH	FALSCH	Baer.2020	Baer, Steffen	"Und dann war ich geoutet!"	TUP - Theorie und Praxis der Sozialen Arbeit	1 Soziale Rahmung; 1.1 Diskurse; 1.4 Identitäten; 1.4.2 LGBAQ*	Bisexualität // bisexuality; Coming out // coming out; Diskriminierung // discrimination; Queer Theorie // Queer Theory; Selbstbestimmung // agency; Sexualität // sexuality; Sexualkultur // sexuality culture
FALSCH	FALSCH	FALSCH	Kampert.2020	Kampert, Meike; Rusack, Tanja; Schröer, Wolfgang	Lehrbuch Schutzkonzepte und Diversität in Organisationen gestalten		1 Soziale Rahmung; 1.1 Diskurse; 2 Institutioneller Kontext; 2.1 Institutionelle Dynamiken; 2.2 Einrichtungen; 3.2 Gewaltprävention; 3.4 Intervention; 3.5 Praxismaterialien; 4 Fachkräfte; 4.1 Pädagogische Fachkräfte; 4.2 Andere Fachkräfte; 5 Adressat*innen; 5.2 Jugendliche; 6 Gewalt; 6.1 Sexueller Missbrauch; 6.2 Übergriff, Peergewalt; 6.3 Diskriminierung; 6.5 Negative Folgen; 8 Forschung; 9 Förderlinie; 9.2.3 FosterCare; 9.2.11 SchutzNorm	Diversität // diversity; Geflüchtete // refugees; Handbuch // handbook; Handlungsempfehlungen // guidelines; Institutionelle Dynamiken // institutional dynamics; Organisationskultur // organisational culture; Pädagogik // pedagogy; Rassismus // racism; Risikofaktoren // risk factors; Schutzfaktoren // protection factor; Schutzkonzept // protection concept; Soziale Arbeit // Social Work
WAHR	FALSCH	FALSCH	Kanis.2020	Kanis, Stefan; Zdun, Steffen; Krause, Daniela; Heitmeyer, Wilhelm	Jugendliche - Realitätskontrolle und Gewalt		1 Soziale Rahmung; 1.1 Diskurse; 3 Thematischer Fokus; 3.2 Gewaltprävention; 5 Adressat*innen; 5.2 Jugendliche; 6 Gewalt; 6.5 Negative Folgen; 8 Forschung	Aggression // aggression; Forschungsergebnisse // research results; Forschungsmethoden // research methods; Forschungsstand // state of research; Gewalt // violence; Jugendliche // youth; Resilienz // resilience; Risikofaktoren // risk factors; Schule // school; Schüler*innen // pupils; Soziale Ungleichheit // social inequality; Stationäre Einrichtungen // residential care
FALSCH	FALSCH	FALSCH	Kappler.2019	Kappler, Selina	Kinder und Jugendliche besser schützen - der Anfang ist gemacht		1 Soziale Rahmung; 2 Institutioneller Kontext; 2.1 Institutionelle Dynamiken; 2.2.1 Kita; 2.2.2 Grundschule; 2.2.3 Weiterführende Schule; 2.2.4 Stationäre Einrichtung; 3 Thematischer Fokus; 3.2 Gewaltprävention; 3.3 Kinderschutz; 4 Fachkräfte; 4.1 Pädagogische Fachkräfte; 4.2 Andere Fachkräfte; 5 Adressat*innen; 5.1 Kinder; 5.2 Jugendliche; 5.3 Eltern und Familie; 6 Gewalt; 6.1 Sexueller Missbrauch; 6.2 Übergriff, Peergewalt; 6.5 Negative Folgen; 8 Forschung	Forschungsergebnisse // research results; Forschungsstand // state of research; Jugendarbeit // youth work; Jugendliche // youth; Kinder // children; Kinder- und Jugendhilfe // child welfare system; Kinderschutz // child protection; Organisationskultur // organisational culture; Pädagogik // pedagogy; Pädagogische Einrichtung // educational facilities; Prävention // prevention; Praxis // practice; Schule // school; Schutzfaktoren // protection factor; Sexualisierte Gewalt // sexual violence; Sexueller Missbrauch // sexual abuse; Sexueller Übergriff // sexual assault
FALSCH	FALSCH	FALSCH	Kargel.2019	Kärgel, Katharina; Vobbe, Frederic	7 Thesen zu sexualisierter Gewalt mit digitalem Medieneinsatz gegen Kinder und Jugendliche	PR (Pädagogische Rundschau)	1 Soziale Rahmung; 1.1 Diskurse; 1.3 Medien und Technologie; 3 Thematischer Fokus; 3.2 Gewaltprävention; 5 Adressat*innen; 5.2 Jugendliche; 6 Gewalt; 6.1 Sexueller Missbrauch; 6.2 Übergriff, Peergewalt; 6.4 Disclosure, Aufarbeitung; 8 Forschung; 9 Förderlinie; 9.2.4 HUman	Aufarbeitung // rehabilitation; Digitale Medien // digital media; Disclosure // disclosure; Diversität // diversity; Forschungspraxis // research practice; Forschungsstand // state of research; Intervention // intervention; Medien // media; Prävention // prevention; Sexualisierte Gewalt // sexual violence
FALSCH	FALSCH	FALSCH	Kargel.2020	Kärgel, Katharina; Vobbe, Frederic	Mediatisierte Gewalt – Diffusion – Transzendenz	Kindesmisshandlung und -vernachlässigung	1 Soziale Rahmung; 1.1 Diskurse; 1.3 Medien und Technologie; 3 Thematischer Fokus; 3.2 Gewaltprävention; 3.3 Kinderschutz; 4 Fachkräfte; 4.1 Pädagogische Fachkräfte; 4.2 Andere Fachkräfte; 6 Gewalt; 6.1 Sexueller Missbrauch; 6.2 Übergriff, Peergewalt; 6.5 Negative Folgen; 8 Forschung; 9 Förderlinie; 9.2.4 HUman	Betroffene sexualisierter Gewalt // sexual assault survivors; Bewältigung // coping; Digitale Medien // digital media; Fachberatungsstelle // specialist counselling; Intervention // intervention; Medien // media; Normen // norms; Prävention // prevention; Recht // law; Resilienz // resilience; Sexualisierte Gewalt // sexual violence
FALSCH	FALSCH	FALSCH	KatjaKrolzikMatthei.2020	Krolzik-Matthei, Katja; Linke, Torsten; Magdon, Greta; Tanger, Irina; Voß, Heinz-Jürgen	Umgang mit Sexualität und sexualisierter Gewalt in den ambulanten Erziehungshilfen. Eine Handreichung für Fachkräfte		1 Soziale Rahmung; 1.2 Leitlinien; 3 Thematischer Fokus; 3.1 Sexualpädagogik; 3.2 Gewaltprävention; 4 Fachkräfte; 4.1 Pädagogische Fachkräfte; 5 Adressat*innen; 5.2 Jugendliche; 5.3 Eltern und Familie; 9 Förderlinie; 9.3.1 Forschungsprof Merseburg	Handlungsempfehlungen // guidelines; junge Erwachsene // young adults; Kinder- und Jugendhilfe // child welfare system; Nähe-Distanz-Regulation // boundary management; Pädagogik // pedagogy; Praxis // practice; Sexualisierte Gewalt // sexual violence; Sexualität // sexuality; Soziale Arbeit // Social Work
